{
  "format": "PlotFont",
  "version": "0.2",
  "id": "plotfont-demo-regular",
  "familyName": "PlotFont Demo",
  "styleName": "Regular",
  "unitsPerEm": 1000,
  "metrics": {
    "ascender": 800,
    "descender": -200,
    "capHeight": 700,
    "xHeight": 500,
    "lineGap": 200
  },
  "missingGlyph": ".notdef",
  "glyphs": [
    {
      "name": ".notdef",
      "unicodes": [],
      "advanceWidth": 650,
      "strokes": [
        {
          "closed": true,
          "commands": [["M", 50, 0], ["L", 50, 700], ["L", 550, 700], ["L", 550, 0]]
        }
      ]
    },
    {
      "name": "space",
      "unicodes": ["0020"],
      "advanceWidth": 350,
      "strokes": []
    },
    {
      "name": "A",
      "unicodes": ["0041"],
      "advanceWidth": 650,
      "strokes": [
        {
          "closed": false,
          "commands": [["M", 50, 0], ["L", 300, 700], ["L", 550, 0]]
        },
        {
          "closed": false,
          "commands": [["M", 150, 280], ["L", 450, 280]]
        }
      ]
    }
  ],
  "kerning": [],
  "metadata": {
    "description": "Illustrative geometry for draft 0.2; not a complete font or a Glyphs export."
  }
}
